database.name	Term	Overlap	P.value	Adjusted.P.value	Old.P.value	Old.Adjusted.P.value	Odds.Ratio	Combined.Score	Genes
GO_Biological_Process_2021	atrioventricular valve morphogenesis (GO:0003181)	1/19	0.02535182406329611	0.0700344139748555	0	0	42.638888888888886	156.69384876205734	ACVR1
GO_Biological_Process_2021	regulation of bicellular tight junction assembly (GO:2000810)	1/19	0.02535182406329611	0.0700344139748555	0	0	42.638888888888886	156.69384876205734	PRKACA
GO_Biological_Process_2021	response to cholesterol (GO:0070723)	1/19	0.02535182406329611	0.0700344139748555	0	0	42.638888888888886	156.69384876205734	TGFB1
GO_Biological_Process_2021	regulation of collagen biosynthetic process (GO:0032965)	1/19	0.02535182406329611	0.0700344139748555	0	0	42.638888888888886	156.69384876205734	TGFB1
GO_Biological_Process_2021	interleukin-7-mediated signaling pathway (GO:0038111)	1/19	0.02535182406329611	0.0700344139748555	0	0	42.638888888888886	156.69384876205734	JAK3
GO_Biological_Process_2021	cellular response to glucagon stimulus (GO:0071377)	1/19	0.02535182406329611	0.0700344139748555	0	0	42.638888888888886	156.69384876205734	PRKACA
GO_Biological_Process_2021	negative regulation of RNA metabolic process (GO:0051253)	1/19	0.02535182406329611	0.0700344139748555	0	0	42.638888888888886	156.69384876205734	TGFB1
GO_Biological_Process_2021	cellular response to interleukin-7 (GO:0098761)	1/19	0.02535182406329611	0.0700344139748555	0	0	42.638888888888886	156.69384876205734	JAK3
GO_Biological_Process_2021	leukocyte adhesion to vascular endothelial cell (GO:0061756)	1/19	0.02535182406329611	0.0700344139748555	0	0	42.638888888888886	156.69384876205734	VCAM1
GO_Biological_Process_2021	neuromuscular process (GO:0050905)	1/19	0.02535182406329611	0.0700344139748555	0	0	42.638888888888886	156.69384876205734	TIFAB
GO_Biological_Process_2021	endocardial cushion morphogenesis (GO:0003203)	1/19	0.02535182406329611	0.0700344139748555	0	0	42.638888888888886	156.69384876205734	ACVR1
GO_Biological_Process_2021	pore complex assembly (GO:0046931)	1/19	0.02535182406329611	0.0700344139748555	0	0	42.638888888888886	156.69384876205734	GSDMD
GO_Biological_Process_2021	positive regulation of actin cytoskeleton reorganization (GO:2000251)	1/19	0.02535182406329611	0.0700344139748555	0	0	42.638888888888886	156.69384876205734	FES
GO_Biological_Process_2021	regulation of tissue remodeling (GO:0034103)	1/20	0.02666884553614584	0.07216916159373343	0	0	40.392712550607285	146.39366123411943	TGFB1
GO_Biological_Process_2021	growth hormone receptor signaling pathway (GO:0060396)	1/20	0.02666884553614584	0.07216916159373343	0	0	40.392712550607285	146.39366123411943	JAK3
GO_Biological_Process_2021	regulation of fibroblast growth factor receptor signaling pathway (GO:0040036)	1/20	0.02666884553614584	0.07216916159373343	0	0	40.392712550607285	146.39366123411943	SPRY4
GO_Biological_Process_2021	lipopolysaccharide-mediated signaling pathway (GO:0031663)	1/20	0.02666884553614584	0.07216916159373343	0	0	40.392712550607285	146.39366123411943	TGFB1
GO_Biological_Process_2021	endoplasmic reticulum calcium ion homeostasis (GO:0032469)	1/20	0.02666884553614584	0.07216916159373343	0	0	40.392712550607285	146.39366123411943	TGM2
GO_Biological_Process_2021	negative regulation of cell communication (GO:0010648)	1/21	0.027984153316513986	0.0723002045804088	0	0	38.371153846153845	137.21973105106596	ACVR1
GO_Biological_Process_2021	regulation of cardiac muscle contraction by calcium ion signaling (GO:0010882)	1/21	0.027984153316513986	0.0723002045804088	0	0	38.371153846153845	137.21973105106596	PRKACA
GO_Biological_Process_2021	response to glucagon (GO:0033762)	1/21	0.027984153316513986	0.0723002045804088	0	0	38.371153846153845	137.21973105106596	PRKACA
GO_Biological_Process_2021	response to progesterone (GO:0032570)	1/21	0.027984153316513986	0.0723002045804088	0	0	38.371153846153845	137.21973105106596	TGFB1
GO_Biological_Process_2021	negative regulation of protein localization to cell periphery (GO:1904376)	1/21	0.027984153316513986	0.0723002045804088	0	0	38.371153846153845	137.21973105106596	TGFB1
GO_Biological_Process_2021	negative regulation of protein localization to plasma membrane (GO:1903077)	1/21	0.027984153316513986	0.0723002045804088	0	0	38.371153846153845	137.21973105106596	TGFB1
GO_Biological_Process_2021	regulation of fibroblast migration (GO:0010762)	1/21	0.027984153316513986	0.0723002045804088	0	0	38.371153846153845	137.21973105106596	TGFB1
GO_Biological_Process_2021	negative regulation of small GTPase mediated signal transduction (GO:0051058)	1/21	0.027984153316513986	0.0723002045804088	0	0	38.371153846153845	137.21973105106596	SPRY4
GO_Biological_Process_2021	positive regulation of transcription regulatory region DNA binding (GO:2000679)	1/21	0.027984153316513986	0.0723002045804088	0	0	38.371153846153845	137.21973105106596	TGFB1
GO_Biological_Process_2021	endocardial cushion development (GO:0003197)	1/21	0.027984153316513986	0.0723002045804088	0	0	38.371153846153845	137.21973105106596	ACVR1
GO_Biological_Process_2021	negative regulation of macromolecule metabolic process (GO:0010605)	2/194	0.028025871157111706	0.0723002045804088	0	0	8.242083333333333	29.462375478235074	TGFB1;RIN3
GO_Biological_Process_2021	regulation of programmed cell death (GO:0043067)	2/194	0.028025871157111706	0.0723002045804088	0	0	8.242083333333333	29.462375478235074	JAK3;TGM2
GO_Biological_Process_2021	negative regulation of biomineral tissue development (GO:0070168)	1/22	0.029297749526199113	0.0735773027873864	0	0	36.54212454212454	129.00263688319484	TGFB1
GO_Biological_Process_2021	negative regulation of lymphocyte activation (GO:0051250)	1/22	0.029297749526199113	0.0735773027873864	0	0	36.54212454212454	129.00263688319484	JAK3
GO_Biological_Process_2021	cellular response to nerve growth factor stimulus (GO:1990090)	1/22	0.029297749526199113	0.0735773027873864	0	0	36.54212454212454	129.00263688319484	ACAP2
GO_Biological_Process_2021	positive regulation of peptidase activity (GO:0010952)	1/22	0.029297749526199113	0.0735773027873864	0	0	36.54212454212454	129.00263688319484	VSIR
GO_Biological_Process_2021	membrane lipid metabolic process (GO:0006643)	1/22	0.029297749526199113	0.0735773027873864	0	0	36.54212454212454	129.00263688319484	ST3GAL6
GO_Biological_Process_2021	membrane protein intracellular domain proteolysis (GO:0031293)	1/22	0.029297749526199113	0.0735773027873864	0	0	36.54212454212454	129.00263688319484	TGFB1
GO_Biological_Process_2021	mitochondrial calcium ion homeostasis (GO:0051560)	1/22	0.029297749526199113	0.0735773027873864	0	0	36.54212454212454	129.00263688319484	TGM2
GO_Biological_Process_2021	regulation of release of sequestered calcium ion into cytosol by sarcoplasmic reticulum (GO:0010880)	1/23	0.030609636304970163	0.07516366248220452	0	0	34.87937062937063	121.60484715637173	PRKACA
GO_Biological_Process_2021	regulation of SMAD protein signal transduction (GO:0060390)	1/23	0.030609636304970163	0.07516366248220452	0	0	34.87937062937063	121.60484715637173	TGFB1
GO_Biological_Process_2021	positive regulation of interleukin-17 production (GO:0032740)	1/23	0.030609636304970163	0.07516366248220452	0	0	34.87937062937063	121.60484715637173	TGFB1
GO_Biological_Process_2021	hyaluronan metabolic process (GO:0030212)	1/23	0.030609636304970163	0.07516366248220452	0	0	34.87937062937063	121.60484715637173	TGFB1
GO_Biological_Process_2021	oligosaccharide biosynthetic process (GO:0009312)	1/23	0.030609636304970163	0.07516366248220452	0	0	34.87937062937063	121.60484715637173	ST3GAL6
GO_Biological_Process_2021	ear morphogenesis (GO:0042471)	1/23	0.030609636304970163	0.07516366248220452	0	0	34.87937062937063	121.60484715637173	TIFAB
GO_Biological_Process_2021	extracellular matrix assembly (GO:0085029)	1/24	0.03191981578702488	0.07612531606761688	0	0	33.36120401337793	114.91361059553886	TGFB1
GO_Biological_Process_2021	carbohydrate biosynthetic process (GO:0016051)	1/24	0.03191981578702488	0.07612531606761688	0	0	33.36120401337793	114.91361059553886	ST3GAL6
GO_Biological_Process_2021	regulation of cellular response to transforming growth factor beta stimulus (GO:1903844)	1/24	0.03191981578702488	0.07612531606761688	0	0	33.36120401337793	114.91361059553886	TGFB1
GO_Biological_Process_2021	cardiac muscle cell differentiation (GO:0055007)	1/24	0.03191981578702488	0.07612531606761688	0	0	33.36120401337793	114.91361059553886	ACVR1
GO_Biological_Process_2021	inner ear morphogenesis (GO:0042472)	1/24	0.03191981578702488	0.07612531606761688	0	0	33.36120401337793	114.91361059553886	TIFAB
GO_Biological_Process_2021	positive regulation of phospholipase activity (GO:0010518)	1/24	0.03191981578702488	0.07612531606761688	0	0	33.36120401337793	114.91361059553886	GNA13
GO_Biological_Process_2021	dorsal/ventral pattern formation (GO:0009953)	1/24	0.03191981578702488	0.07612531606761688	0	0	33.36120401337793	114.91361059553886	ACVR1
GO_Biological_Process_2021	protein kinase B signaling (GO:0043491)	1/24	0.03191981578702488	0.07612531606761688	0	0	33.36120401337793	114.91361059553886	TGFB1
GO_Biological_Process_2021	mitotic cell cycle phase transition (GO:0044772)	2/209	0.032140613687398525	0.07622960669313258	0	0	7.639033816425121	26.260208674105698	ACVR1;PRKACA
GO_Biological_Process_2021	regulation of proteolysis involved in cellular protein catabolic process (GO:1903050)	1/25	0.033228290097006515	0.07622960669313258	0	0	31.96955128205128	108.83565874121032	PRKACA
GO_Biological_Process_2021	regulation of ryanodine-sensitive calcium-release channel activity (GO:0060314)	1/25	0.033228290097006515	0.07622960669313258	0	0	31.96955128205128	108.83565874121032	PRKACA
GO_Biological_Process_2021	receptor catabolic process (GO:0032801)	1/25	0.033228290097006515	0.07622960669313258	0	0	31.96955128205128	108.83565874121032	TGFB1
GO_Biological_Process_2021	RNA splicing, via transesterification reactions (GO:0000375)	1/25	0.033228290097006515	0.07622960669313258	0	0	31.96955128205128	108.83565874121032	SF3A3
GO_Biological_Process_2021	cellular response to hexose stimulus (GO:0071331)	1/25	0.033228290097006515	0.07622960669313258	0	0	31.96955128205128	108.83565874121032	PRKACA
GO_Biological_Process_2021	negative regulation of signaling (GO:0023057)	1/25	0.033228290097006515	0.07622960669313258	0	0	31.96955128205128	108.83565874121032	ACVR1
GO_Biological_Process_2021	positive regulation of peptidyl-threonine phosphorylation (GO:0010800)	1/25	0.033228290097006515	0.07622960669313258	0	0	31.96955128205128	108.83565874121032	TGFB1
GO_Biological_Process_2021	outflow tract septum morphogenesis (GO:0003148)	1/25	0.033228290097006515	0.07622960669313258	0	0	31.96955128205128	108.83565874121032	ACVR1
GO_Biological_Process_2021	positive regulation of vascular endothelial growth factor production (GO:0010575)	1/25	0.033228290097006515	0.07622960669313258	0	0	31.96955128205128	108.83565874121032	TGFB1
GO_Biological_Process_2021	ventricular cardiac muscle tissue development (GO:0003229)	1/25	0.033228290097006515	0.07622960669313258	0	0	31.96955128205128	108.83565874121032	TGFB1
GO_Biological_Process_2021	negative regulation of multicellular organismal process (GO:0051241)	2/214	0.03356248182400418	0.07673077741143025	0	0	7.456981132075471	25.31157742047583	TIFAB;TGFB1
GO_Biological_Process_2021	extracellular structure organization (GO:0043062)	2/216	0.034138115815491026	0.076834717054074	0	0	7.3865420560747665	24.946869510303024	VCAM1;ICAM1
GO_Biological_Process_2021	external encapsulating structure organization (GO:0045229)	2/217	0.03442739671656247	0.076834717054074	0	0	7.351813953488372	24.76754525580241	VCAM1;ICAM1
GO_Biological_Process_2021	regulation of regulatory T cell differentiation (GO:0045589)	1/26	0.034535061360654686	0.076834717054074	0	0	30.689230769230768	103.29320526635196	VSIR
GO_Biological_Process_2021	regulation of biomineral tissue development (GO:0070167)	1/26	0.034535061360654686	0.076834717054074	0	0	30.689230769230768	103.29320526635196	TGFB1
GO_Biological_Process_2021	negative regulation of protein localization to membrane (GO:1905476)	1/26	0.034535061360654686	0.076834717054074	0	0	30.689230769230768	103.29320526635196	TGFB1
GO_Biological_Process_2021	positive regulation of microtubule polymerization or depolymerization (GO:0031112)	1/26	0.034535061360654686	0.076834717054074	0	0	30.689230769230768	103.29320526635196	FES
GO_Biological_Process_2021	negative regulation of receptor-mediated endocytosis (GO:0048261)	1/26	0.034535061360654686	0.076834717054074	0	0	30.689230769230768	103.29320526635196	RIN3
GO_Biological_Process_2021	endothelial cell development (GO:0001885)	1/26	0.034535061360654686	0.076834717054074	0	0	30.689230769230768	103.29320526635196	ICAM1
GO_Biological_Process_2021	negative regulation of endothelial cell apoptotic process (GO:2000352)	1/27	0.03584013171184842	0.07790822073755903	0	0	29.507396449704142	98.22088743474232	ICAM1
GO_Biological_Process_2021	regulation of transcription regulatory region DNA binding (GO:2000677)	1/27	0.03584013171184842	0.07790822073755903	0	0	29.507396449704142	98.22088743474232	TGFB1
GO_Biological_Process_2021	regulation of vascular endothelial growth factor production (GO:0010574)	1/27	0.03584013171184842	0.07790822073755903	0	0	29.507396449704142	98.22088743474232	TGFB1
GO_Biological_Process_2021	positive regulation of gene silencing by miRNA (GO:2000637)	1/27	0.03584013171184842	0.07790822073755903	0	0	29.507396449704142	98.22088743474232	TGFB1
GO_Biological_Process_2021	regulation of cell junction assembly (GO:1901888)	1/27	0.03584013171184842	0.07790822073755903	0	0	29.507396449704142	98.22088743474232	PRKACA
GO_Biological_Process_2021	positive regulation of striated muscle cell differentiation (GO:0051155)	1/27	0.03584013171184842	0.07790822073755903	0	0	29.507396449704142	98.22088743474232	TGFB1
GO_Biological_Process_2021	protein export from nucleus (GO:0006611)	1/27	0.03584013171184842	0.07790822073755903	0	0	29.507396449704142	98.22088743474232	TGFB1
GO_Biological_Process_2021	response to ketone (GO:1901654)	1/28	0.037143503267645234	0.07842720594410442	0	0	28.413105413105413	93.56340148780022	TGFB1
GO_Biological_Process_2021	positive regulation of microtubule polymerization (GO:0031116)	1/28	0.037143503267645234	0.07842720594410442	0	0	28.413105413105413	93.56340148780022	FES
GO_Biological_Process_2021	keratan sulfate biosynthetic process (GO:0018146)	1/28	0.037143503267645234	0.07842720594410442	0	0	28.413105413105413	93.56340148780022	ST3GAL6
GO_Biological_Process_2021	cellular response to interleukin-6 (GO:0071354)	1/28	0.037143503267645234	0.07842720594410442	0	0	28.413105413105413	93.56340148780022	ST3GAL6
GO_Biological_Process_2021	positive regulation of phosphatidylinositol 3-kinase activity (GO:0043552)	1/28	0.037143503267645234	0.07842720594410442	0	0	28.413105413105413	93.56340148780022	TGFB1
GO_Biological_Process_2021	positive regulation of protein import into nucleus (GO:0042307)	1/28	0.037143503267645234	0.07842720594410442	0	0	28.413105413105413	93.56340148780022	TGFB1
GO_Biological_Process_2021	macromolecule catabolic process (GO:0009057)	1/28	0.037143503267645234	0.07842720594410442	0	0	28.413105413105413	93.56340148780022	TGFB1
GO_Biological_Process_2021	T cell activation involved in immune response (GO:0002286)	1/28	0.037143503267645234	0.07842720594410442	0	0	28.413105413105413	93.56340148780022	ICAM1
GO_Biological_Process_2021	ventricular septum morphogenesis (GO:0060412)	1/28	0.037143503267645234	0.07842720594410442	0	0	28.413105413105413	93.56340148780022	ACVR1
GO_Biological_Process_2021	establishment of endothelial barrier (GO:0061028)	1/29	0.038445178147396245	0.0796536034741366	0	0	27.396978021978022	89.27365552728025	ICAM1
GO_Biological_Process_2021	positive regulation of dephosphorylation (GO:0035306)	1/29	0.038445178147396245	0.0796536034741366	0	0	27.396978021978022	89.27365552728025	TGFB1
GO_Biological_Process_2021	regulation of calcium ion transmembrane transporter activity (GO:1901019)	1/29	0.038445178147396245	0.0796536034741366	0	0	27.396978021978022	89.27365552728025	PRKACA
GO_Biological_Process_2021	negative regulation of interferon-gamma production (GO:0032689)	1/29	0.038445178147396245	0.0796536034741366	0	0	27.396978021978022	89.27365552728025	VSIR
GO_Biological_Process_2021	positive regulation of leukocyte migration (GO:0002687)	1/29	0.038445178147396245	0.0796536034741366	0	0	27.396978021978022	89.27365552728025	ICAM1
GO_Biological_Process_2021	positive regulation of viral genome replication (GO:0045070)	1/29	0.038445178147396245	0.0796536034741366	0	0	27.396978021978022	89.27365552728025	SRPK1
GO_Biological_Process_2021	regulation of striated muscle contraction (GO:0006942)	1/30	0.03974515847448719	0.08009434671302433	0	0	26.450928381962864	85.31131290182489	PRKACA
GO_Biological_Process_2021	positive regulation of endopeptidase activity (GO:0010950)	1/30	0.03974515847448719	0.08009434671302433	0	0	26.450928381962864	85.31131290182489	VSIR
GO_Biological_Process_2021	response to alcohol (GO:0097305)	1/30	0.03974515847448719	0.08009434671302433	0	0	26.450928381962864	85.31131290182489	TGFB1
GO_Biological_Process_2021	heterotypic cell-cell adhesion (GO:0034113)	1/30	0.03974515847448719	0.08009434671302433	0	0	26.450928381962864	85.31131290182489	VCAM1
GO_Biological_Process_2021	positive regulation of lipid kinase activity (GO:0090218)	1/30	0.03974515847448719	0.08009434671302433	0	0	26.450928381962864	85.31131290182489	TGFB1
GO_Biological_Process_2021	positive regulation of protein import (GO:1904591)	1/30	0.03974515847448719	0.08009434671302433	0	0	26.450928381962864	85.31131290182489	TGFB1
GO_Biological_Process_2021	positive regulation of small GTPase mediated signal transduction (GO:0051057)	1/30	0.03974515847448719	0.08009434671302433	0	0	26.450928381962864	85.31131290182489	TGM2
GO_Biological_Process_2021	primary neural tube formation (GO:0014020)	1/30	0.03974515847448719	0.08009434671302433	0	0	26.450928381962864	85.31131290182489	TGFB1
GO_Biological_Process_2021	mRNA splice site selection (GO:0006376)	1/30	0.03974515847448719	0.08009434671302433	0	0	26.450928381962864	85.31131290182489	SF3A3
GO_Biological_Process_2021	regulation of ERK1 and ERK2 cascade (GO:0070372)	2/238	0.040722347155882264	0.08074719565494647	0	0	6.690508474576271	21.416172222621526	TGFB1;ICAM1
GO_Biological_Process_2021	receptor signaling pathway via JAK-STAT (GO:0007259)	1/31	0.041043446358547446	0.08074719565494647	0	0	25.567948717948717	81.6416333934617	JAK3
GO_Biological_Process_2021	regulation of transmembrane receptor protein serine/threonine kinase signaling pathway (GO:0090092)	1/31	0.041043446358547446	0.08074719565494647	0	0	25.567948717948717	81.6416333934617	TGFB1
GO_Biological_Process_2021	renal water homeostasis (GO:0003091)	1/31	0.041043446358547446	0.08074719565494647	0	0	25.567948717948717	81.6416333934617	PRKACA
GO_Biological_Process_2021	regulation of cellular component size (GO:0032535)	1/31	0.041043446358547446	0.08074719565494647	0	0	25.567948717948717	81.6416333934617	RIN3
GO_Biological_Process_2021	positive regulation of locomotion (GO:0040017)	1/31	0.041043446358547446	0.08074719565494647	0	0	25.567948717948717	81.6416333934617	TGFB1
GO_Biological_Process_2021	tube closure (GO:0060606)	1/31	0.041043446358547446	0.08074719565494647	0	0	25.567948717948717	81.6416333934617	TGFB1
GO_Biological_Process_2021	peptide cross-linking (GO:0018149)	1/31	0.041043446358547446	0.08074719565494647	0	0	25.567948717948717	81.6416333934617	TGM2
GO_Biological_Process_2021	aortic valve morphogenesis (GO:0003180)	1/32	0.04234004393150865	0.08160304978659952	0	0	24.741935483870968	78.2345437210345	TGFB1
GO_Biological_Process_2021	hematopoietic progenitor cell differentiation (GO:0002244)	1/32	0.04234004393150865	0.08160304978659952	0	0	24.741935483870968	78.2345437210345	TGFB1
GO_Biological_Process_2021	regulation of chemotaxis (GO:0050920)	1/32	0.04234004393150865	0.08160304978659952	0	0	24.741935483870968	78.2345437210345	TGFB1
GO_Biological_Process_2021	cardiac muscle tissue morphogenesis (GO:0055008)	1/32	0.04234004393150865	0.08160304978659952	0	0	24.741935483870968	78.2345437210345	TGFB1
GO_Biological_Process_2021	cellular response to glucose stimulus (GO:0071333)	1/32	0.04234004393150865	0.08160304978659952	0	0	24.741935483870968	78.2345437210345	PRKACA
GO_Biological_Process_2021	regulation of intracellular protein transport (GO:0033157)	1/32	0.04234004393150865	0.08160304978659952	0	0	24.741935483870968	78.2345437210345	TGFB1
GO_Biological_Process_2021	chondrocyte differentiation (GO:0002062)	1/32	0.04234004393150865	0.08160304978659952	0	0	24.741935483870968	78.2345437210345	TGFB1
GO_Biological_Process_2021	apoptotic cell clearance (GO:0043277)	1/33	0.04363495328991679	0.08320497500560657	0	0	23.967548076923077	75.0638863791398	TGM2
GO_Biological_Process_2021	keratan sulfate metabolic process (GO:0042339)	1/33	0.04363495328991679	0.08320497500560657	0	0	23.967548076923077	75.0638863791398	ST3GAL6
GO_Biological_Process_2021	vasculogenesis (GO:0001570)	1/33	0.04363495328991679	0.08320497500560657	0	0	23.967548076923077	75.0638863791398	TGFB1
GO_Biological_Process_2021	epithelial tube morphogenesis (GO:0060562)	1/34	0.0449281765490304	0.08320497500560657	0	0	23.24009324009324	72.10680817166444	ACVR1
GO_Biological_Process_2021	negative regulation of blood vessel endothelial cell migration (GO:0043537)	1/34	0.0449281765490304	0.08320497500560657	0	0	23.24009324009324	72.10680817166444	TGFB1
GO_Biological_Process_2021	negative regulation of extrinsic apoptotic signaling pathway via death domain receptors (GO:1902042)	1/34	0.0449281765490304	0.08320497500560657	0	0	23.24009324009324	72.10680817166444	ICAM1
GO_Biological_Process_2021	positive regulation of DNA binding (GO:0043388)	1/34	0.0449281765490304	0.08320497500560657	0	0	23.24009324009324	72.10680817166444	TGFB1
GO_Biological_Process_2021	response to steroid hormone (GO:0048545)	1/34	0.0449281765490304	0.08320497500560657	0	0	23.24009324009324	72.10680817166444	TGFB1
GO_Biological_Process_2021	cellular response to amino acid stimulus (GO:0071230)	1/34	0.0449281765490304	0.08320497500560657	0	0	23.24009324009324	72.10680817166444	CASTOR1
GO_Biological_Process_2021	positive regulation of pri-miRNA transcription by RNA polymerase II (GO:1902895)	1/34	0.0449281765490304	0.08320497500560657	0	0	23.24009324009324	72.10680817166444	TGFB1
GO_Biological_Process_2021	positive regulation of protein dephosphorylation (GO:0035307)	1/34	0.0449281765490304	0.08320497500560657	0	0	23.24009324009324	72.10680817166444	TGFB1
GO_Biological_Process_2021	neural tube closure (GO:0001843)	1/34	0.0449281765490304	0.08320497500560657	0	0	23.24009324009324	72.10680817166444	TGFB1
GO_Biological_Process_2021	regulation of myoblast differentiation (GO:0045661)	1/34	0.0449281765490304	0.08320497500560657	0	0	23.24009324009324	72.10680817166444	TGFB1
GO_Biological_Process_2021	ventricular cardiac muscle tissue morphogenesis (GO:0055010)	1/34	0.0449281765490304	0.08320497500560657	0	0	23.24009324009324	72.10680817166444	TGFB1
GO_Biological_Process_2021	regulation of TORC1 signaling (GO:1903432)	1/35	0.046219715818065006	0.08488551686254044	0	0	22.555429864253394	69.34325924679375	CASTOR1
GO_Biological_Process_2021	negative regulation of Ras protein signal transduction (GO:0046580)	1/35	0.046219715818065006	0.08488551686254044	0	0	22.555429864253394	69.34325924679375	SPRY4
GO_Biological_Process_2021	regulation of phosphatidylinositol 3-kinase activity (GO:0043551)	1/35	0.046219715818065006	0.08488551686254044	0	0	22.555429864253394	69.34325924679375	TGFB1
GO_Biological_Process_2021	regulation of receptor internalization (GO:0002090)	1/36	0.047509573208732836	0.08513201901997262	0	0	21.90989010989011	66.75558005419848	RIN3
GO_Biological_Process_2021	aortic valve development (GO:0003176)	1/36	0.047509573208732836	0.08513201901997262	0	0	21.90989010989011	66.75558005419848	TGFB1
GO_Biological_Process_2021	negative regulation of fat cell differentiation (GO:0045599)	1/36	0.047509573208732836	0.08513201901997262	0	0	21.90989010989011	66.75558005419848	TGFB1
GO_Biological_Process_2021	regulation of cardiac muscle contraction (GO:0055117)	1/36	0.047509573208732836	0.08513201901997262	0	0	21.90989010989011	66.75558005419848	PRKACA
GO_Biological_Process_2021	positive regulation of myeloid leukocyte differentiation (GO:0002763)	1/36	0.047509573208732836	0.08513201901997262	0	0	21.90989010989011	66.75558005419848	FES
GO_Biological_Process_2021	cellular response to heat (GO:0034605)	1/36	0.047509573208732836	0.08513201901997262	0	0	21.90989010989011	66.75558005419848	PRKACA
GO_Biological_Process_2021	regulation of mRNA processing (GO:0050684)	1/36	0.047509573208732836	0.08513201901997262	0	0	21.90989010989011	66.75558005419848	SRPK1
GO_Biological_Process_2021	regulation of ossification (GO:0030278)	1/36	0.047509573208732836	0.08513201901997262	0	0	21.90989010989011	66.75558005419848	ACVR1
GO_Biological_Process_2021	regulation of protein import into nucleus (GO:0042306)	1/36	0.047509573208732836	0.08513201901997262	0	0	21.90989010989011	66.75558005419848	TGFB1
GO_Biological_Process_2021	regulation of actin cytoskeleton reorganization (GO:2000249)	1/37	0.048797750803848496	0.08650510369773143	0	0	21.300213675213676	64.32815883418561	FES
GO_Biological_Process_2021	negative regulation of epithelial cell apoptotic process (GO:1904036)	1/37	0.048797750803848496	0.08650510369773143	0	0	21.300213675213676	64.32815883418561	ICAM1
GO_Biological_Process_2021	regulation of transport (GO:0051049)	1/37	0.048797750803848496	0.08650510369773143	0	0	21.300213675213676	64.32815883418561	FES
GO_Biological_Process_2021	positive regulation of myeloid cell differentiation (GO:0045639)	1/37	0.048797750803848496	0.08650510369773143	0	0	21.300213675213676	64.32815883418561	FES
