database.name	Term	Overlap	P.value	Adjusted.P.value	Old.P.value	Old.Adjusted.P.value	Odds.Ratio	Combined.Score	Genes
GO_Biological_Process_2021	negative regulation of signal transduction (GO:0009968)	2/267	0.05007097170035996	0.08738383745485415	0	0	5.949584905660378	17.814924460917734	ACVR1;SPRY4
GO_Biological_Process_2021	positive regulation of cell development (GO:0010720)	1/38	0.05008425072827236	0.08738383745485415	0	0	20.723492723492722	62.04714597227348	TGM2
GO_Biological_Process_2021	negative regulation of endothelial cell migration (GO:0010596)	1/38	0.05008425072827236	0.08738383745485415	0	0	20.723492723492722	62.04714597227348	TGFB1
GO_Biological_Process_2021	response to estradiol (GO:0032355)	1/38	0.05008425072827236	0.08738383745485415	0	0	20.723492723492722	62.04714597227348	TGFB1
GO_Biological_Process_2021	negative regulation of TOR signaling (GO:0032007)	1/38	0.05008425072827236	0.08738383745485415	0	0	20.723492723492722	62.04714597227348	CASTOR1
GO_Biological_Process_2021	ventricular septum development (GO:0003281)	1/38	0.05008425072827236	0.08738383745485415	0	0	20.723492723492722	62.04714597227348	ACVR1
GO_Biological_Process_2021	negative regulation of cellular metabolic process (GO:0031324)	1/39	0.0513690750681718	0.08892349026161334	0	0	20.177125506072876	59.9002146437606	RIN3
GO_Biological_Process_2021	membrane protein proteolysis (GO:0033619)	1/39	0.0513690750681718	0.08892349026161334	0	0	20.177125506072876	59.9002146437606	TGFB1
GO_Biological_Process_2021	regulation of peptidyl-threonine phosphorylation (GO:0010799)	1/39	0.0513690750681718	0.08892349026161334	0	0	20.177125506072876	59.9002146437606	TGFB1
GO_Biological_Process_2021	positive regulation of MAPK cascade (GO:0043410)	2/274	0.052434856631967036	0.08973888378026579	0	0	5.794411764705882	17.082990350006572	TGFB1;ICAM1
GO_Biological_Process_2021	mRNA splicing, via spliceosome (GO:0000398)	2/274	0.052434856631967036	0.08973888378026579	0	0	5.794411764705882	17.082990350006572	SF3A3;SRPK1
GO_Biological_Process_2021	negative regulation of cell-substrate adhesion (GO:0010812)	1/40	0.052652225928391236	0.08973888378026579	0	0	19.65877712031558	57.87635915452169	SPRY4
GO_Biological_Process_2021	bone development (GO:0060348)	1/40	0.052652225928391236	0.08973888378026579	0	0	19.65877712031558	57.87635915452169	TGM2
GO_Biological_Process_2021	regulation of microtubule polymerization (GO:0031113)	1/40	0.052652225928391236	0.08973888378026579	0	0	19.65877712031558	57.87635915452169	FES
GO_Biological_Process_2021	organic hydroxy compound transport (GO:0015850)	1/40	0.052652225928391236	0.08973888378026579	0	0	19.65877712031558	57.87635915452169	SLC16A1
GO_Biological_Process_2021	negative regulation of cell-cell adhesion (GO:0022408)	1/41	0.0539337053893905	0.09098739611492596	0	0	19.166346153846153	55.96572434095457	TGFB1
GO_Biological_Process_2021	response to growth factor (GO:0070848)	1/41	0.0539337053893905	0.09098739611492596	0	0	19.166346153846153	55.96572434095457	ACVR1
GO_Biological_Process_2021	carboxylic acid transmembrane transport (GO:1905039)	1/41	0.0539337053893905	0.09098739611492596	0	0	19.166346153846153	55.96572434095457	SLC16A1
GO_Biological_Process_2021	regulation of protein dephosphorylation (GO:0035304)	1/41	0.0539337053893905	0.09098739611492596	0	0	19.166346153846153	55.96572434095457	TGFB1
GO_Biological_Process_2021	positive regulation of epithelial to mesenchymal transition (GO:0010718)	1/42	0.055213515553328894	0.0926748374983723	0	0	18.69793621013133	54.15946054707467	TGFB1
GO_Biological_Process_2021	regulation of extrinsic apoptotic signaling pathway via death domain receptors (GO:1902041)	1/42	0.055213515553328894	0.0926748374983723	0	0	18.69793621013133	54.15946054707467	ICAM1
GO_Biological_Process_2021	regulation of cell-cell adhesion (GO:0022407)	1/43	0.056491658509140605	0.0940154849922255	0	0	18.251831501831504	52.449599887168155	TGFB1
GO_Biological_Process_2021	cellular glucose homeostasis (GO:0001678)	1/43	0.056491658509140605	0.0940154849922255	0	0	18.251831501831504	52.449599887168155	PRKACA
GO_Biological_Process_2021	positive regulation of T cell differentiation (GO:0045582)	1/43	0.056491658509140605	0.0940154849922255	0	0	18.251831501831504	52.449599887168155	VSIR
GO_Biological_Process_2021	positive regulation of programmed cell death (GO:0043068)	2/286	0.05657945476907689	0.0940154849922255	0	0	5.546197183098592	15.929284784388255	GNA13;TGM2
GO_Biological_Process_2021	positive regulation of biosynthetic process (GO:0009891)	1/44	0.05776813633613761	0.09480265938331493	0	0	17.826475849731665	50.82895021500038	TGFB1
GO_Biological_Process_2021	cardiac ventricle morphogenesis (GO:0003208)	1/44	0.05776813633613761	0.09480265938331493	0	0	17.826475849731665	50.82895021500038	TGFB1
GO_Biological_Process_2021	regulation of endothelial cell apoptotic process (GO:2000351)	1/44	0.05776813633613761	0.09480265938331493	0	0	17.826475849731665	50.82895021500038	ICAM1
GO_Biological_Process_2021	positive regulation of osteoblast differentiation (GO:0045669)	1/44	0.05776813633613761	0.09480265938331493	0	0	17.826475849731665	50.82895021500038	ACVR1
GO_Biological_Process_2021	embryonic organ morphogenesis (GO:0048562)	1/44	0.05776813633613761	0.09480265938331493	0	0	17.826475849731665	50.82895021500038	ACVR1
GO_Biological_Process_2021	regulation of receptor signaling pathway via JAK-STAT (GO:0046425)	1/45	0.05904295112171703	0.09501329270315144	0	0	17.420454545454547	49.29100393195118	JAK3
GO_Biological_Process_2021	positive regulation of chemotaxis (GO:0050921)	1/45	0.05904295112171703	0.09501329270315144	0	0	17.420454545454547	49.29100393195118	TGFB1
GO_Biological_Process_2021	positive regulation of nervous system development (GO:0051962)	1/45	0.05904295112171703	0.09501329270315144	0	0	17.420454545454547	49.29100393195118	TGM2
GO_Biological_Process_2021	negative regulation of T cell activation (GO:0050868)	1/45	0.05904295112171703	0.09501329270315144	0	0	17.420454545454547	49.29100393195118	JAK3
GO_Biological_Process_2021	positive regulation of RNA metabolic process (GO:0051254)	1/45	0.05904295112171703	0.09501329270315144	0	0	17.420454545454547	49.29100393195118	TGFB1
GO_Biological_Process_2021	zymogen activation (GO:0031638)	1/45	0.05904295112171703	0.09501329270315144	0	0	17.420454545454547	49.29100393195118	VSIR
GO_Biological_Process_2021	protein deacetylation (GO:0006476)	1/45	0.05904295112171703	0.09501329270315144	0	0	17.420454545454547	49.29100393195118	MIER3
GO_Biological_Process_2021	regulation of pri-miRNA transcription by RNA polymerase II (GO:1902893)	1/45	0.05904295112171703	0.09501329270315144	0	0	17.420454545454547	49.29100393195118	TGFB1
GO_Biological_Process_2021	regulation of cell cycle (GO:0051726)	2/296	0.060119512068493565	0.09612879227441887	0	0	5.354829931972789	15.054680412338532	TGFB1;PRKACA
GO_Biological_Process_2021	erythrocyte differentiation (GO:0030218)	1/46	0.06031610495649811	0.09612879227441887	0	0	17.032478632478632	47.829859287186046	JAK3
GO_Biological_Process_2021	positive regulation of nucleocytoplasmic transport (GO:0046824)	1/46	0.06031610495649811	0.09612879227441887	0	0	17.032478632478632	47.829859287186046	TGFB1
GO_Biological_Process_2021	negative regulation of tumor necrosis factor production (GO:0032720)	1/46	0.06031610495649811	0.09612879227441887	0	0	17.032478632478632	47.829859287186046	VSIR
GO_Biological_Process_2021	mRNA processing (GO:0006397)	2/300	0.06155686299926461	0.09630325174413491	0	0	5.281879194630872	14.724790756392848	SF3A3;PRKACA
GO_Biological_Process_2021	epidermal growth factor receptor signaling pathway (GO:0007173)	1/47	0.06158759990876803	0.09630325174413491	0	0	16.661371237458194	46.440152226223375	TGFB1
GO_Biological_Process_2021	epithelial to mesenchymal transition (GO:0001837)	1/47	0.06158759990876803	0.09630325174413491	0	0	16.661371237458194	46.440152226223375	TGFB1
GO_Biological_Process_2021	regulation of T cell activation (GO:0050863)	1/47	0.06158759990876803	0.09630325174413491	0	0	16.661371237458194	46.440152226223375	JAK3
GO_Biological_Process_2021	histone deacetylation (GO:0016575)	1/47	0.06158759990876803	0.09630325174413491	0	0	16.661371237458194	46.440152226223375	MIER3
GO_Biological_Process_2021	regulation of DNA binding (GO:0051101)	1/47	0.06158759990876803	0.09630325174413491	0	0	16.661371237458194	46.440152226223375	TGFB1
GO_Biological_Process_2021	embryonic heart tube morphogenesis (GO:0003143)	1/47	0.06158759990876803	0.09630325174413491	0	0	16.661371237458194	46.440152226223375	ACVR1
GO_Biological_Process_2021	regulation of protein localization to nucleus (GO:1900180)	1/47	0.06158759990876803	0.09630325174413491	0	0	16.661371237458194	46.440152226223375	TGFB1
GO_Biological_Process_2021	innate immune response (GO:0045087)	2/302	0.06228002808004758	0.09691739869398207	0	0	5.246133333333334	14.563866716703176	FES;SRPK1
GO_Biological_Process_2021	MAPK cascade (GO:0000165)	2/303	0.06264272427143729	0.09691739869398207	0	0	5.22843853820598	14.484383736504364	TGFB1;JAK3
GO_Biological_Process_2021	positive regulation of blood vessel endothelial cell migration (GO:0043536)	1/48	0.06285743806698686	0.09691739869398207	0	0	16.306055646481177	45.11699715873728	TGFB1
GO_Biological_Process_2021	negative regulation of MAP kinase activity (GO:0043407)	1/48	0.06285743806698686	0.09691739869398207	0	0	16.306055646481177	45.11699715873728	SPRY4
GO_Biological_Process_2021	negative regulation of mitotic cell cycle (GO:0045930)	1/48	0.06285743806698686	0.09691739869398207	0	0	16.306055646481177	45.11699715873728	TGFB1
GO_Biological_Process_2021	negative regulation of tumor necrosis factor superfamily cytokine production (GO:1903556)	1/48	0.06285743806698686	0.09691739869398207	0	0	16.306055646481177	45.11699715873728	VSIR
GO_Biological_Process_2021	response to glucose (GO:0009749)	1/49	0.06412562148920224	0.09773629206285307	0	0	15.965544871794872	43.85593535873217	PRKACA
GO_Biological_Process_2021	regulation of cellular localization (GO:0060341)	1/49	0.06412562148920224	0.09773629206285307	0	0	15.965544871794872	43.85593535873217	FES
GO_Biological_Process_2021	regulation of cellular protein metabolic process (GO:0032268)	1/49	0.06412562148920224	0.09773629206285307	0	0	15.965544871794872	43.85593535873217	TGFB1
GO_Biological_Process_2021	positive regulation of reactive oxygen species metabolic process (GO:2000379)	1/49	0.06412562148920224	0.09773629206285307	0	0	15.965544871794872	43.85593535873217	TGFB1
GO_Biological_Process_2021	oligosaccharide metabolic process (GO:0009311)	1/49	0.06412562148920224	0.09773629206285307	0	0	15.965544871794872	43.85593535873217	ST3GAL6
GO_Biological_Process_2021	positive regulation of apoptotic process (GO:0043065)	2/310	0.0652021540906028	0.09914914716071023	0	0	5.107792207792208	13.945614914068672	GNA13;TGM2
GO_Biological_Process_2021	regulation of cellular component movement (GO:0051270)	1/50	0.06539215225886762	0.09921051933095933	0	0	15.638932496075354	42.652889831563165	FES
GO_Biological_Process_2021	regulation of substrate adhesion-dependent cell spreading (GO:1900024)	1/51	0.06665703244937396	0.10024773477131577	0	0	15.325384615384616	41.504125770986924	SPRY4
GO_Biological_Process_2021	regulation of interleukin-12 production (GO:0032655)	1/51	0.06665703244937396	0.10024773477131577	0	0	15.325384615384616	41.504125770986924	JAK3
GO_Biological_Process_2021	mesenchymal cell differentiation (GO:0048762)	1/51	0.06665703244937396	0.10024773477131577	0	0	15.325384615384616	41.504125770986924	TGFB1
GO_Biological_Process_2021	cilium assembly (GO:0060271)	2/314	0.06668061996101095	0.10024773477131577	0	0	5.041282051282051	13.650989845806723	EHD4;PRKACA
GO_Biological_Process_2021	regulation of release of sequestered calcium ion into cytosol (GO:0051279)	1/52	0.06792026411773805	0.10119356204507939	0	0	15.024132730015083	40.40621579213957	PRKACA
GO_Biological_Process_2021	glycolipid metabolic process (GO:0006664)	1/52	0.06792026411773805	0.10119356204507939	0	0	15.024132730015083	40.40621579213957	ST3GAL6
GO_Biological_Process_2021	cartilage development (GO:0051216)	1/52	0.06792026411773805	0.10119356204507939	0	0	15.024132730015083	40.40621579213957	TGFB1
GO_Biological_Process_2021	myeloid cell differentiation (GO:0030099)	1/52	0.06792026411773805	0.10119356204507939	0	0	15.024132730015083	40.40621579213957	JAK3
GO_Biological_Process_2021	heart morphogenesis (GO:0003007)	1/53	0.06918184933137322	0.10284207647242252	0	0	14.734467455621301	39.35600928291532	ACVR1
GO_Biological_Process_2021	cellular response to oxygen-containing compound (GO:1901701)	2/323	0.07004858786944483	0.10389756992716313	0	0	4.897694704049845	13.020845428139992	FES;TGM2
GO_Biological_Process_2021	negative regulation of viral genome replication (GO:0045071)	1/54	0.0704417901623858	0.10401538280102848	0	0	14.455732946298983	38.35060533159885	SRPK1
GO_Biological_Process_2021	regulation of proteasomal protein catabolic process (GO:0061136)	1/54	0.0704417901623858	0.10401538280102848	0	0	14.455732946298983	38.35060533159885	PRKACA
GO_Biological_Process_2021	pyruvate metabolic process (GO:0006090)	1/55	0.07170008865913224	0.10517070526770947	0	0	14.187321937321938	37.38732875362038	SLC16A1
GO_Biological_Process_2021	regulation of blood vessel endothelial cell migration (GO:0043535)	1/55	0.07170008865913224	0.10517070526770947	0	0	14.187321937321938	37.38732875362038	TGFB1
GO_Biological_Process_2021	regulation of cardiac conduction (GO:1903779)	1/55	0.07170008865913224	0.10517070526770947	0	0	14.187321937321938	37.38732875362038	PRKACA
GO_Biological_Process_2021	glycosaminoglycan catabolic process (GO:0006027)	1/56	0.07295674689077883	0.1060752701504087	0	0	13.928671328671328	36.46370879499823	TGFB1
GO_Biological_Process_2021	blood vessel morphogenesis (GO:0048514)	1/56	0.07295674689077883	0.1060752701504087	0	0	13.928671328671328	36.46370879499823	TGFB1
GO_Biological_Process_2021	positive regulation of interleukin-1 beta production (GO:0032731)	1/56	0.07295674689077883	0.1060752701504087	0	0	13.928671328671328	36.46370879499823	GSDMD
GO_Biological_Process_2021	Rho protein signal transduction (GO:0007266)	1/56	0.07295674689077883	0.1060752701504087	0	0	13.928671328671328	36.46370879499823	GNA13
GO_Biological_Process_2021	carboxylic acid transport (GO:0046942)	1/57	0.07421176689431265	0.10742882412866657	0	0	13.679258241758241	35.577460203094	SLC16A1
GO_Biological_Process_2021	monocarboxylic acid transport (GO:0015718)	1/57	0.07421176689431265	0.10742882412866657	0	0	13.679258241758241	35.577460203094	SLC16A1
GO_Biological_Process_2021	receptor metabolic process (GO:0043112)	1/58	0.07546515074471088	0.10853231007319591	0	0	13.43859649122807	34.726466325654	TGFB1
GO_Biological_Process_2021	chordate embryonic development (GO:0043009)	1/58	0.07546515074471088	0.10853231007319591	0	0	13.43859649122807	34.726466325654	TGFB1
GO_Biological_Process_2021	regulation of phagocytosis (GO:0050764)	1/58	0.07546515074471088	0.10853231007319591	0	0	13.43859649122807	34.726466325654	TGM2
GO_Biological_Process_2021	regulation of apoptotic process (GO:0042981)	3/742	0.07695597073820969	0.11043681515028793	0	0	3.253382949932341	8.343371594069856	GNA13;JAK3;TGM2
GO_Biological_Process_2021	response to organic cyclic compound (GO:0014070)	1/60	0.07796701814188411	0.11140545911221804	0	0	12.98174706649283	33.12253021761694	TGFB1
GO_Biological_Process_2021	peptidyl-threonine phosphorylation (GO:0018107)	1/60	0.07796701814188411	0.11140545911221804	0	0	12.98174706649283	33.12253021761694	ACVR1
GO_Biological_Process_2021	positive regulation of multicellular organismal process (GO:0051240)	2/345	0.0785133290082955	0.11194481103763422	0	0	4.578425655976677	11.64974397754182	ACVR1;TGFB1
GO_Biological_Process_2021	negative regulation of response to stimulus (GO:0048585)	1/61	0.07921550578349737	0.11270360586793725	0	0	12.76474358974359	32.366069643921364	ACVR1
GO_Biological_Process_2021	positive regulation of interleukin-1 production (GO:0032732)	1/62	0.08046236546006223	0.1139883510684215	0	0	12.554854981084489	31.637804092649077	GSDMD
GO_Biological_Process_2021	regulation of neurogenesis (GO:0050767)	1/62	0.08046236546006223	0.1139883510684215	0	0	12.554854981084489	31.637804092649077	TGM2
GO_Biological_Process_2021	anterior/posterior pattern specification (GO:0009952)	1/63	0.08170759918722283	0.11501515554379772	0	0	12.351736972704714	30.936262547654483	TIFAB
GO_Biological_Process_2021	cell cycle G1/S phase transition (GO:0044843)	1/63	0.08170759918722283	0.11501515554379772	0	0	12.351736972704714	30.936262547654483	ACVR1
GO_Biological_Process_2021	positive regulation of viral process (GO:0048524)	1/63	0.08170759918722283	0.11501515554379772	0	0	12.351736972704714	30.936262547654483	SRPK1
GO_Biological_Process_2021	regulation of extrinsic apoptotic signaling pathway (GO:2001236)	1/64	0.08295120902835007	0.11651832963092393	0	0	12.155067155067155	30.260072343994267	ACVR1
GO_Biological_Process_2021	ERBB signaling pathway (GO:0038127)	1/66	0.08543356514088656	0.11949884744389827	0	0	11.779881656804733	28.978699956832514	TGFB1
GO_Biological_Process_2021	embryonic organ development (GO:0048568)	1/66	0.08543356514088656	0.11949884744389827	0	0	11.779881656804733	28.978699956832514	TGFB1
GO_Biological_Process_2021	positive regulation of catabolic process (GO:0009896)	1/67	0.08667231548375737	0.12021704009567184	0	0	11.60081585081585	28.37119607885258	VSIR
GO_Biological_Process_2021	regulation of viral genome replication (GO:0045069)	1/67	0.08667231548375737	0.12021704009567184	0	0	11.60081585081585	28.37119607885258	SRPK1
GO_Biological_Process_2021	regulation of gene silencing by miRNA (GO:0060964)	1/67	0.08667231548375737	0.12021704009567184	0	0	11.60081585081585	28.37119607885258	TGFB1
GO_Biological_Process_2021	peptidyl-threonine modification (GO:0018210)	1/67	0.08667231548375737	0.12021704009567184	0	0	11.60081585081585	28.37119607885258	ACVR1
GO_Biological_Process_2021	negative regulation of transforming growth factor beta receptor signaling pathway (GO:0030512)	1/68	0.08790945005341633	0.12117248520876303	0	0	11.427095292766934	27.784387663217135	TGFB1
GO_Biological_Process_2021	positive regulation of protein localization to nucleus (GO:1900182)	1/68	0.08790945005341633	0.12117248520876303	0	0	11.427095292766934	27.784387663217135	TGFB1
GO_Biological_Process_2021	regulation of myeloid cell differentiation (GO:0045637)	1/68	0.08790945005341633	0.12117248520876303	0	0	11.427095292766934	27.784387663217135	FES
GO_Biological_Process_2021	positive regulation of protein phosphorylation (GO:0001934)	2/371	0.08891404106138254	0.12186209422791806	0	0	4.250189701897019	10.285821223382902	ACVR1;TGFB1
GO_Biological_Process_2021	positive regulation of MAP kinase activity (GO:0043406)	1/69	0.08914497089070929	0.12186209422791806	0	0	11.258484162895927	27.217288055780262	TGFB1
GO_Biological_Process_2021	positive regulation of protein polymerization (GO:0032273)	1/69	0.08914497089070929	0.12186209422791806	0	0	11.258484162895927	27.217288055780262	FES
GO_Biological_Process_2021	positive regulation of protein transport (GO:0051222)	1/69	0.08914497089070929	0.12186209422791806	0	0	11.258484162895927	27.217288055780262	TGFB1
GO_Biological_Process_2021	negative regulation of viral process (GO:0048525)	1/70	0.09037887999460255	0.12304147317540347	0	0	11.094760312151616	26.668970934836352	SRPK1
GO_Biological_Process_2021	defense response to Gram-positive bacterium (GO:0050830)	1/70	0.09037887999460255	0.12304147317540347	0	0	11.094760312151616	26.668970934836352	GSDMD
GO_Biological_Process_2021	positive regulation of cellular protein localization (GO:1903829)	1/71	0.09161117940546835	0.12420902238410127	0	0	10.935714285714285	26.13856581636218	TGFB1
GO_Biological_Process_2021	regulation of endopeptidase activity (GO:0052548)	1/71	0.09161117940546835	0.12420902238410127	0	0	10.935714285714285	26.13856581636218	VSIR
GO_Biological_Process_2021	extrinsic apoptotic signaling pathway (GO:0097191)	1/72	0.09284187114106916	0.12435183952834111	0	0	10.781148429035753	25.62525396907896	TGFB1
GO_Biological_Process_2021	negative regulation of epithelial cell proliferation (GO:0050680)	1/72	0.09284187114106916	0.12435183952834111	0	0	10.781148429035753	25.62525396907896	TGFB1
GO_Biological_Process_2021	cell junction organization (GO:0034330)	1/72	0.09284187114106916	0.12435183952834111	0	0	10.781148429035753	25.62525396907896	TGFB1
GO_Biological_Process_2021	positive regulation of neurogenesis (GO:0050769)	1/72	0.09284187114106916	0.12435183952834111	0	0	10.781148429035753	25.62525396907896	TGM2
GO_Biological_Process_2021	positive regulation of protein secretion (GO:0050714)	1/72	0.09284187114106916	0.12435183952834111	0	0	10.781148429035753	25.62525396907896	TGFB1
GO_Biological_Process_2021	positive regulation of secretion by cell (GO:1903532)	1/72	0.09284187114106916	0.12435183952834111	0	0	10.781148429035753	25.62525396907896	TGFB1
GO_Biological_Process_2021	negative regulation of cell adhesion (GO:0007162)	1/73	0.09407095720227293	0.12549103546299187	0	0	10.630876068376068	25.12826467235412	TGFB1
GO_Biological_Process_2021	defense response to Gram-negative bacterium (GO:0050829)	1/73	0.09407095720227293	0.12549103546299187	0	0	10.630876068376068	25.12826467235412	GSDMD
GO_Biological_Process_2021	positive regulation of macromolecule metabolic process (GO:0010604)	2/384	0.09426411193536323	0.12549619721515223	0	0	4.10282722513089	9.689461343548398	TGFB1;VSIR
GO_Biological_Process_2021	cellular response to amino acid starvation (GO:0034198)	1/74	0.09529843961938218	0.12661896887304688	0	0	10.484720758693362	24.64687178715262	CASTOR1
GO_Biological_Process_2021	response to amino acid starvation (GO:1990928)	1/75	0.09652432039763756	0.1279912488472674	0	0	10.342515592515593	24.18039062518233	CASTOR1
GO_Biological_Process_2021	regulation of RNA splicing (GO:0043484)	1/76	0.09774860155754135	0.1290982526546811	0	0	10.204102564102564	23.72817506630132	SRPK1
GO_Biological_Process_2021	regulation of epithelial to mesenchymal transition (GO:0010717)	1/76	0.09774860155754135	0.1290982526546811	0	0	10.204102564102564	23.72817506630132	TGFB1
GO_Biological_Process_2021	negative regulation of developmental process (GO:0051093)	1/77	0.09897128507986962	0.130453204787184	0	0	10.069331983805668	23.28961492092306	TGFB1
GO_Biological_Process_2021	negative regulation of apoptotic signaling pathway (GO:2001234)	1/78	0.1001923729898059	0.13127972982656386	0	0	9.938061938061939	22.864133490479528	ACVR1
GO_Biological_Process_2021	protein modification process (GO:0036211)	1/78	0.1001923729898059	0.13127972982656386	0	0	9.938061938061939	22.864133490479528	ST3GAL6
GO_Biological_Process_2021	negative regulation of protein serine/threonine kinase activity (GO:0071901)	1/78	0.1001923729898059	0.13127972982656386	0	0	9.938061938061939	22.864133490479528	SPRY4
GO_Biological_Process_2021	negative regulation of cell cycle (GO:0045786)	1/80	0.10262976996432173	0.13315760760537243	0	0	9.685491723466408	22.05025422007099	TGFB1
GO_Biological_Process_2021	positive regulation of cell adhesion (GO:0045785)	1/80	0.10262976996432173	0.13315760760537243	0	0	9.685491723466408	22.05025422007099	TGM2
GO_Biological_Process_2021	negative regulation of cellular response to growth factor stimulus (GO:0090288)	1/80	0.10262976996432173	0.13315760760537243	0	0	9.685491723466408	22.05025422007099	SPRY4
GO_Biological_Process_2021	regulation of fat cell differentiation (GO:0045598)	1/80	0.10262976996432173	0.13315760760537243	0	0	9.685491723466408	22.05025422007099	TGFB1
GO_Biological_Process_2021	regulation of protein localization to plasma membrane (GO:1903076)	1/80	0.10262976996432173	0.13315760760537243	0	0	9.685491723466408	22.05025422007099	TGFB1
GO_Biological_Process_2021	negative regulation of protein modification process (GO:0031400)	1/81	0.10384608302388916	0.13421043478526026	0	0	9.563942307692308	21.660851190982118	TGFB1
GO_Biological_Process_2021	phospholipase C-activating G protein-coupled receptor signaling pathway (GO:0007200)	1/81	0.10384608302388916	0.13421043478526026	0	0	9.563942307692308	21.660851190982118	TGM2
GO_Biological_Process_2021	positive regulation of cytoskeleton organization (GO:0051495)	1/82	0.10506080846323412	0.13525304079829945	0	0	9.445394112060779	21.282512839552783	FES
GO_Biological_Process_2021	cell-cell junction organization (GO:0045216)	1/82	0.10506080846323412	0.13525304079829945	0	0	9.445394112060779	21.282512839552783	TGFB1
GO_Biological_Process_2021	glycoprotein biosynthetic process (GO:0009101)	1/83	0.10627394826975518	0.13628554681401875	0	0	9.329737335834897	20.914799669740503	ST3GAL6
GO_Biological_Process_2021	regulation of interleukin-1 beta production (GO:0032651)	1/83	0.10627394826975518	0.13628554681401875	0	0	9.329737335834897	20.914799669740503	GSDMD
GO_Biological_Process_2021	nuclear export (GO:0051168)	1/84	0.10748550442129846	0.13730807212200555	0	0	9.216867469879517	20.557294597238432	TGFB1
GO_Biological_Process_2021	vascular transport (GO:0010232)	1/84	0.10748550442129846	0.13730807212200555	0	0	9.216867469879517	20.557294597238432	SLC16A1
GO_Biological_Process_2021	G1/S transition of mitotic cell cycle (GO:0000082)	1/85	0.10869547892866405	0.13832073422208113	0	0	9.106684981684982	20.20960155430532	ACVR1
GO_Biological_Process_2021	regulation of cell cycle G2/M phase transition (GO:1902749)	1/85	0.10869547892866405	0.13832073422208113	0	0	9.106684981684982	20.20960155430532	PRKACA
GO_Biological_Process_2021	regulation of Ras protein signal transduction (GO:0046578)	1/86	0.1099038737594078	0.13852902719104063	0	0	8.999095022624434	19.871344206358376	SPRY4
GO_Biological_Process_2021	positive regulation of endothelial cell migration (GO:0010595)	1/86	0.1099038737594078	0.13852902719104063	0	0	8.999095022624434	19.871344206358376	TGFB1
